mysql> notee
mysql> source text.sql
ERROR: 
Failed to open file 'text.sql', error: 2
mysql> source test.sql
+----------+
| count(*) |
+----------+
|     3503 |
+----------+
1 row in set (0.00 sec)

ERROR 1064 (42000): You have an error in your SQL syntax; check the manual that corresponds to your MySQL server version for the right syntax to use near ':' at line 1
mysql> select * from Album limit 5;
+---------+---------------------------------------+----------+
| AlbumId | Title                                 | ArtistId |
+---------+---------------------------------------+----------+
|       1 | For Those About To Rock We Salute You |        1 |
|       2 | Balls to the Wall                     |        2 |
|       3 | Restless and Wild                     |        2 |
|       4 | Let There Be Rock                     |        1 |
|       5 | Big Ones                              |        3 |
+---------+---------------------------------------+----------+
5 rows in set (0.00 sec)

mysql> select Title, Name from Album
    -> join Artist on Album.ArtistId = Artist.ArtistId
    -> limit 10;
+---------------------------------------+-----------------------+
| Title                                 | Name                  |
+---------------------------------------+-----------------------+
| For Those About To Rock We Salute You | AC/DC                 |
| Balls to the Wall                     | Accept                |
| Restless and Wild                     | Accept                |
| Let There Be Rock                     | AC/DC                 |
| Big Ones                              | Aerosmith             |
| Jagged Little Pill                    | Alanis Morissette     |
| Facelift                              | Alice In Chains       |
| Warner 25 Anos                        | Antônio Carlos Jobim  |
| Plays Metallica By Four Cellos        | Apocalyptica          |
| Audioslave                            | Audioslave            |
+---------------------------------------+-----------------------+
10 rows in set (0.00 sec)

mysql> insert into Genre (Name) values('Trad');
Query OK, 1 row affected (0.02 sec)

mysql> SELECT LAST INSERT ID();
ERROR 1064 (42000): You have an error in your SQL syntax; check the manual that corresponds to your MySQL server version for the right syntax to use near 'INSERT ID()' at line 1
mysql> SELECT LAST INSERT_ID();
ERROR 1064 (42000): You have an error in your SQL syntax; check the manual that corresponds to your MySQL server version for the right syntax to use near '()' at line 1
mysql> SELECT LAST_SELECT_ID();
ERROR 1305 (42000): FUNCTION Chinook.LAST_SELECT_ID does not exist
mysql> SELECT LAST_INSERT_ID();
+------------------+
| LAST_INSERT_ID() |
+------------------+
|               26 |
+------------------+
1 row in set (0.00 sec)

mysql> select * from Genre where GenreId = 26;
+---------+------+
| GenreId | Name |
+---------+------+
|      26 | Trad |
+---------+------+
1 row in set (0.00 sec)

mysql> update Genre set Name = 'Traditional' where Name = 'Trad';
Query OK, 1 row affected (0.01 sec)
Rows matched: 1  Changed: 1  Warnings: 0

mysql> select * from Genre;
+---------+--------------------+
| GenreId | Name               |
+---------+--------------------+
|       1 | Rock               |
|       2 | Jazz               |
|       3 | Metal              |
|       4 | Alternative & Punk |
|       5 | Rock And Roll      |
|       6 | Blues              |
|       7 | Latin              |
|       8 | Reggae             |
|       9 | Pop                |
|      10 | Soundtrack         |
|      11 | Bossa Nova         |
|      12 | Easy Listening     |
|      13 | Heavy Metal        |
|      14 | R&B/Soul           |
|      15 | Electronica/Dance  |
|      16 | World              |
|      17 | Hip Hop/Rap        |
|      18 | Science Fiction    |
|      19 | TV Shows           |
|      20 | Sci Fi & Fantasy   |
|      21 | Drama              |
|      22 | Comedy             |
|      23 | Alternative        |
|      24 | Classical          |
|      25 | Opera              |
|      26 | Traditional        |
+---------+--------------------+
26 rows in set (0.00 sec)

mysql> 
mysql> delete from Genre where Name = 'Traditional';
Query OK, 1 row affected (0.03 sec)

mysql> select * from Genre where Name = 'Traditional';
Empty set (0.00 sec)

mysql> select * from Genre;
+---------+--------------------+
| GenreId | Name               |
+---------+--------------------+
|       1 | Rock               |
|       2 | Jazz               |
|       3 | Metal              |
|       4 | Alternative & Punk |
|       5 | Rock And Roll      |
|       6 | Blues              |
|       7 | Latin              |
|       8 | Reggae             |
|       9 | Pop                |
|      10 | Soundtrack         |
|      11 | Bossa Nova         |
|      12 | Easy Listening     |
|      13 | Heavy Metal        |
|      14 | R&B/Soul           |
|      15 | Electronica/Dance  |
|      16 | World              |
|      17 | Hip Hop/Rap        |
|      18 | Science Fiction    |
|      19 | TV Shows           |
|      20 | Sci Fi & Fantasy   |
|      21 | Drama              |
|      22 | Comedy             |
|      23 | Alternative        |
|      24 | Classical          |
|      25 | Opera              |
+---------+--------------------+
25 rows in set (0.00 sec)

mysql> delete from Genre where Name = 'Jazz';
ERROR 1451 (23000): Cannot delete or update a parent row: a foreign key constraint fails (`Chinook`.`Track`, CONSTRAINT `FK_TrackGenreId` FOREIGN KEY (`GenreId`) REFERENCES `Genre` (`GenreId`) ON DELETE NO ACTION ON UPDATE NO ACTION)
mysql> delete from Genre where Name = 'Opera';
ERROR 1451 (23000): Cannot delete or update a parent row: a foreign key constraint fails (`Chinook`.`Track`, CONSTRAINT `FK_TrackGenreId` FOREIGN KEY (`GenreId`) REFERENCES `Genre` (`GenreId`) ON DELETE NO ACTION ON UPDATE NO ACTION)
